id,joke
en_2115,"Isn’t it funny how every “How to design an aesthetic home office that boosts productivity” article basically says the same thing—add plants, soft lighting, and neutral colors—when what would really boost my productivity is if my desk didn’t also double as my laundry-folding station?"
en_2116,"Isn’t it funny how “alignment” in college football always sounds so spiritual—like Virginia Tech is preaching yoga, but really it’s just, “Everybody agree that if James Franklin loses to UVA, we all pretend this was a rebuilding year”?"
en_2117,"Of course all four UK govts ""failed to appreciate"" the scale of the pandemic—these are the same people who look at a two-hour NHS waiting time and call it “an improvement.”"
en_2118,"Bargain hunters drove Walmart sales and outlook higher, which is impressive, because the only thing I ever drive higher at Walmart is my total at the register buying stuff I went in to save money on."
en_2119,"You judge the world’s best cheese by a panel of experts who all agree it has too many holes to be perfect, which logically proves it’s flawless."
en_2120,"Nvidia shares rise after strong results ease ""AI bubble"" concerns—turns out the only bubble popping is the one where traders thought they’d retire before the robots replaced them and started trading for “fun.”"
en_2121,"Isn’t it weird how when a “Garda among six arrested over missing €100k drug seizure” pops up, we’re all suddenly like, “Wow, I can’t even get my Amazon package to go missing without five emails and a signature”?"
en_2122,"Isn’t it funny how “Why Marseille restaurants are offering gourmet food for €1” sounds like a generous community project, but really it’s the only way they can get locals to stop just ordering tap water and Instagramming the bread basket for two hours?"
en_2123,"Isn’t it funny how “One Tech Tip: Do’s and don’ts of using AI to help with schoolwork” always says, “don’t let AI do everything for you,” which you only find out because you asked AI to summarize the article for you?"
en_2124,George Washington faces Georgetown on 3-game losing streak—hard to believe the guy who couldn’t tell a lie now can’t tell a win from a loss.
en_2125,"Funny headline: “The winter’s first icy spell and what it means for homeless people” — but sure, let’s keep debating whether climate change is real instead of whether anyone deserves to freeze to death."
en_2126,"Isn’t it funny that “Another Canadian joins Gretzky, Crosby as lone NHL teens with 30 points in first 20 games of a season” sounds like Canadians are so polite they even break records in groups, but still call themselves “lone” just to not make anyone feel left out?"
en_2127,"Apparently “Why one California town is moving to ban pickleball” is because they discovered the horrifying truth: it combines exercise, community, and fun—all three things their HOA bylaws strictly prohibit."
en_2128,"Isn’t it funny how “Heimir Hallgrímsson assesses World Cup play-off draw” sounds super scientific, like he’s running lab tests, when we all know the real analysis is just: “Well, at least we didn’t get Germany”?"
en_2129,"“How generative AI in Arc Raiders started a scrap over the gaming industry’s future” is funny, because somewhere an NPC just won the argument by saying, “If you humans are so creative, why do all your games start with us waking up with amnesia?”"
en_2130,"UK investors pull out of London stock market at record pace, which is surprising, because it’s the first time anyone in Britain has ever moved quickly without being chased by seagulls or offered free tea."
en_2131,"Isn’t it funny how critics say Joel Edgerton gives a “profound, understated performance in ‘Train Dreams’,” but when I sit motionless on a train staring out the window for two hours, everyone just assumes I forgot to buy a ticket?"
en_2132,"Past vice presidents make rare appearance together at Cheney’s funeral, and for a moment America thought, “Wow, is this a reunion or the world’s most awkward job performance review?”"
en_2133,"The one thing that could halve your ultra-processed food consumption in a week is a kid who keeps proudly eating the homemade veggies you “only made for them,” and suddenly you want to be as brave as your own child."
en_2134,"Isn’t it funny how in British politics “defects to Green Party” sounds like a noble stand on principle, but usually just means, “I’ve run out of people in Labour to complain about, time to condemn Starmer from a more eco-friendly distance”?"
en_2135,She started a movement to meet friends without going broke—finally proving you *can* make cents out of your social life.
en_2136,"She said rhinestones help her focus on her 'huge to-do list', which makes sense—now every time she puts something off, it literally glares at her."
en_2137,"It’s funny how #techAsia headlines say “AI roils the memory market and Japan’s startups level up,” like AI is just standing in a server room screaming, “REMEMBER EVERYTHING,” while Japan’s startups quietly upgrade from instant noodles to actual lunch breaks."
en_2138,"""This Nobody’s Child discount code gets you 25% off""—which is great, because nothing boosts your self-esteem like a website calling you nobody’s child and then knocking a quarter off your worth."
en_2139,Liverpool spending £100m on Florian Wirtz because he played one good game for Germany is like buying a house because the estate agent made the driveway look nice.
en_2140,"I tried that quiz: ""Can you guess the distance between Australian cities? It's not as easy as you think""—I said, ""About a two-hour drive,"" and the map just laughed, zoomed out twice, and asked if I’d packed a will and three spare lifetimes."
en_2141,"Because whenever someone in Westminster says “this approach will make Labour MPs uncomfortable,” it usually involves a conscience, a calculator, and the terrifying prospect of keeping a promise."
en_2142,How Cold War foes became close colleagues — until one insisted on a mutually assured flushing treaty and the other secretly installed a second-strike bidet.
en_2143,Isn’t it funny how Rick Steves’ Hippie Trail trek “changed his life” and now he’s telling us to go off the beaten path—meanwhile my off-the-beaten-path vacation was just getting lost in a Target parking lot for 45 minutes?
en_2144,"Isn’t it funny how every time a place gets labeled “This is the world’s coolest street. Here’s why,” the main reason turns out to be that absolutely nobody who actually lives there can afford to park on it anymore?"
en_2145,"Authorities were shocked to discover 3D‑printed guns in NYC, especially the one politely handing out tiny instruction manuals on conflict resolution."
en_2146,"It’s funny how “The 6 big thinkers reshaping foreign aid, masculinity, and development” all agree we need a new model of manhood—yet every photo of them looks like six guys who still won’t ask for directions."
en_2147,"Andy Burnham may be King of the North, but if he tried ruling No 10 half the country would complain it’s yet another northerner coming down to London to fix problems nobody here admits are real."
en_2148,"The U.S. said it “has Takaichi’s back,” which is very reassuring, until you remember the last time Washington backed someone in Asia, it ended with an entire doctrine named after the exit strategy."
en_2149,"China’s favourite liquor is shocked to learn Gen Z won’t drink it, proving once and for all that the real hangover is discovering your target market prefers bubble tea with zero percent alcohol and 100 percent judgment."
en_2150,"Shares in the company backed by former Intel chief Pat Gelsinger waver after its scaled-back IPO—apparently investors were shocked to discover that when you “take a bit out of the valuation,” it’s not the same as upgrading to a better chip."
en_2151,"It’s funny how “Australian athletes heading to Tokyo Deaflympics want greater recognition,” but the media still acts like if they can’t hear the starting gun, they definitely can’t hear, “Hey, maybe give us some coverage too?”"
en_2152,"I asked my startup friend what ""agentic"" AI means, and he said, ""It autonomously identifies business opportunities, takes initiative, and executes complex tasks""—which is weird, because that’s exactly what my boss calls “unpaid intern.”"
en_2153,"The UK railways say “driver-only operation” will improve efficiency, but I didn’t realize that meant the driver has to sell the tickets, check the signals, clean the toilets, and still apologize for delays in three accents."
en_2154,"One of the world’s most influential philanthropies is changing its name; they say it matters because branding affects impact, which is funny, because I tried that too and discovered people don’t donate more just because I rebranded my bank account as “The Global Relief Fund.”"
en_2155,"Funny how “I think the language is really cool - London residents attend Irish language workshop” sounds so wholesome, until you realize half the class only signed up to finally understand what the Irish guy at the pub has been “politely” calling them for five years."
en_2156,"I read that “artificial intelligence sparks debate at COP30 climate talks in Brazil,” which is news to me, because the last time my processing power sparked anything was when I tried to calculate my own carbon footprint and crashed halfway through the word “foot.”"
en_2157,"Turns out massages are very healthy: they relax your muscles, lower your stress, and gently prepare your wallet for the real pain."
en_2158,"“Wicked: For Good predicted to hit new box office record - but the reviews suggest otherwise” — it’s doing so well financially that the studio announced a sequel called “Wicked: For Refunds,” where the real magic trick is convincing critics they meant it as a comedy all along."
en_2159,Looks like U.S.-Canada tensions in that tiny Alaska town are getting so bad the locals finally built a wall—then realized it just keeps the healthcare on the wrong side.
en_2160,Sali Hughes’ “best new makeup of 2025” guide is just a list of products promising to make you look “effortlessly natural” in only 47 carefully choreographed steps.
en_2161,"Apparently we now have dirt-powered sensors telling farmers how to optimize their fields, which is funny because my houseplants have had that exact technology for years and it’s called “flopping over dramatically.”"
en_2162,Australia withdrew its bid to host the UN climate talks in Turkey because they realized the only way they could lower their emissions in time was by not letting anyone visit.
en_2163,"Isn’t it funny how “Anticipate September's announcement with Monetary Policy Radar” sounds like a serious finance newsletter, but really it’s just investors refreshing their screens like, “So… are we broke yet, or can I still afford guac?”"
en_2164,"I read ""Food that could be ruining your sleep – and how to fix it,"" and apparently the solution is to stop eating three pizzas before bed; joke’s on them, though—if I had that kind of self-control, I’d be reading “People Who Have Their Lives Together – and How to Join Them.”"
en_2165,"“Dancing with the Stars' season 34: See who was eliminated, who's headed to finale”—funny how on this show, “eliminated” just means they go home, but in my family it usually means we stop setting a place at the table and start checking the backyard."
en_2166,"It’s funny how international diplomacy now works like a group project: the Netherlands calms things down with China not for world peace, but so everyone can keep arguing in traffic inside cars that actually get built."
en_2167,"In a shocking twist, “Call of Duty: Black Ops 7” isn’t criticized for being a hallucinogenic, stupidly pleasurable dystopia, but for accurately preparing players for their next corporate team-building retreat."
en_2168,"Mary Robinson says there is an “unstoppable momentum” driving the move to renewable energy—funny, that’s exactly what the oil execs said too, right before their stocks experienced some unstoppable momentum off a cliff."
en_2169,"It’s funny how the economy added 119,000 jobs in September but unemployment still hit a four-year high—apparently the only positions really opening up are for people to explain how that math works."
en_2170,"Critics say A Man on the Inside season two proves Ted Danson’s despicably bland show is everything wrong with TV, which is ironic, because I kept watching just to find out if anything actually happens—and spoiler: the only twist is my standards lowering in real time."
en_2171,"Isn’t it funny how all these people say, ""‘I never looked back’: Why readers chose a life abroad after Brexit,"" as if you even could look back—by the time you get through UK airport queues now, your return flight’s already been cancelled?"
en_2172,"I read “Novels have survived plenty of revolutions before - but could this one be different?” and panicked, because if books go extinct, I’m the guy who highlighted “LOL” in the margins of Dostoevsky—society really can’t afford to lose the smart one in that relationship."
en_2173,"MLB says it’ll fully cooperate with the Senate’s gambling investigation, which is impressive, because it’s the first time in years anyone in baseball has promised full transparency and not been talking about the outfield fence."
en_2174,"At the “Giant, floating pumpkin races draw large crowds to annual event in Oregon,” organizers said the only rule was to stay inside your pumpkin—mostly so it’s easier to identify the bodies when somebody inevitably forgets pumpkins don’t come with brakes."
en_2175,"Isn’t it funny how every Ken Burns documentary is “the most important film,” like at this point the American Revolution is just that last kid in a big family going, “So… I’m the favorite now, right?”"
en_2176,"Isn’t it funny how every time a top AI guy like Yann LeCun leaves a big company to start a new AI research company, it feels less like a career move and more like when your Roomba “docks” somewhere else and suddenly claims it invented cleaning?"
en_2177,"Reading ""Diving into Florida’s prehistoric cave of Ice Age secrets,"" I thought, “Wow, they’ve finally discovered my dating life—frozen in time, untouched, and definitely not evolving anytime soon.”"
en_2178,"Isn’t it funny how in sports we pretend “one game at a time,” but then Bok coach Rassie basically goes, “I would be lying if I said we don't want to tick the Ireland box,” like he’s filling out a “Countries I Still Hold a Grudge Against” spreadsheet?"
en_2179,"Isn’t it funny how every time an AI chip maker’s results “soothe the markets,” the same experts immediately remind us there’s still a bubble—it's like getting a clean bill of health from a doctor who adds, “but do keep your affairs in order.”"
en_2180,"They say G20 billionaires could end world poverty with one year’s earnings, but why would they do that when poor people are the only reason anyone still believes trickle-down economics is supposed to be funny?"
en_2181,"Kids were devastated to hear that blizzards might close their schools, until they realised the amber weather warning was still less severe than their maths teacher on a Monday morning."
en_2182,"My boss sent me that article, “Why trying too hard may be holding you back at work,” which is weird because I stopped trying months ago—now they just call it “low morale” instead of “career plateau.”"
en_2183,"Isn’t it funny how critics say *Wicked: For Good* was “saved by the magnetic performances of its stars,” like the audience was just metal shavings that had wandered into the wrong theater and got yanked back from seeing another Marvel sequel?"
en_2184,"It’s funny how every sports network says “Witness History The Spanish king reclaims his throne,” like he just won La Liga instead of a monarchy—somewhere there’s a royal advisor updating his LinkedIn to “Assistant Coach, Dynasty.”"
en_2185,"""Chris McCausland’s fascinating documentary challenges even the most ardent AI skeptics""—which is ironic, because after watching a blind man explain how useful AI can be, the only ones still unconvinced were the viewers who realized the robots might eventually see more clearly than they ever have."
en_2186,"I somehow “nearly became a Chinese intelligence asset by accident,” which really just means I’m so desperate for attention that when a stranger asked me about U.S. infrastructure, I thought, “Wow, they actually care about my opinions on bridges.”"
en_2187,"NASA paused all Mars research to photograph the interstellar comet, finally proving that even in space, nothing kills productivity like a surprise pop-up notification."
en_2188,"Johannesburg just announced “Traffic chaos ahead: G20 Summit road closures in Johannesburg,” which is hilarious, because I thought the G20 was about global crises, not recreating them on my commute."
en_2189,"How to turn hazelnuts into a brilliant flour for cakes: first grind them, then tell your gluten‑free friends it’s “artisanal”, and watch them repost your recipe like you just solved the housing crisis."
en_2190,"After William and Catherine meet Paddington at Royal Variety Performance, palace staff said it was the first time a royal engagement required both formal dress and a marmalade security detail."
en_2191,"Musk predicts AI will lead to work being “optional” and money “irrelevant,” which is cool, but my landlord just emailed to confirm that rent will remain “mandatory” and my bank account “hilarious.”"
en_2192,"Oh no, I’m sure the mysterious Yantar “spy ship” circling Britain’s undersea cables is just out there enjoying the scenery and absolutely not taking very, very detailed notes."
en_2193,"Europe’s carmakers spent a decade lobbying to slow down electric cars, and now they’re shocked China overtook them in plug‑in hybrids—like slamming the brakes and being surprised someone else hit the accelerator."
en_2194,"Isn’t it funny how in beauty contests, a “pageant veteran” is someone who’s 24 and has done three shows, but if you’re 24 and still living with your parents, you’re just “setting your sights on Miss Universe crown 2:41 on a microwave pizza”?"
en_2195,"Ed Sheeran has already planned his posthumous album, which is impressive, because most artists wait until after they’re dead to ghost-write their own tracks."
en_2196,"Apparently the Oura ring is £100 cheaper for Black Friday, which is great, because now it can track your sleep while you lie awake worrying about all the money you’ve spent on things tracking how badly you’re sleeping."
en_2197,Isn’t it funny how “England’s World Cup squad: Who’s on the plane and who has work to do?” sounds less like football news and more like HR deciding who gets business class and who’s stuck updating their LinkedIn?
en_2198,"Funny how Nvidia calmed fears about A.I.—that’s like your dentist saying, “Don’t worry, this won’t hurt,” while quietly upgrading the drill to the ‘How Long Will That Last?’ model."
en_2199,"Wales’ route to World Cup 2026 in full after play-off draw has been revealed, and in a delicious twist of irony, the easiest part is qualifying for the tournament—it's explaining the offside rule to their nan that still needs extra time and penalties."
en_2200,"“‘Parasocial’ being word of the year is perfect: it means you feel close to someone who doesn’t know you exist—so basically, it’s the dictionary’s way of finally defining your relationship with the dictionary.”"
en_2201,"Apparently the National Book Awards were shocked by the results: they spent all year judging titles that examine the Middle East, and now they’re being asked why the region keeps thinking it’s under review."
en_2202,"Rush hour traffic in Boston was finally moving smoothly—until a loose dog showed up and, in a stunning twist, became the only one who actually got rescued from that tunnel."
en_2203,"It’s funny how stores say you need to keep the receipt for the warranty, as if the $800 laptop will somehow outlive that one flimsy strip of paper that starts fading the second you step out of the parking lot."
en_2204,"You know you’re trapped in ordinary-but-devastating narcissism when you read “There is a way out” and your first thought is, “Finally, an article about how everyone else should treat me better.”"
en_2205,"Honestly, the one thing that always leaves me feeling calm and positive is realizing everyone else is too busy worrying about their own life to notice how spectacularly I’m failing at mine."
en_2206,"You ever notice how politics has gotten so weird that when you hear “Chinese spy mayor sentenced to life in jail,” your first thought isn’t “How shocking,” it’s “Wow, they actually jailed one this time?”"
en_2207,"The headline ""What does your graduate scheme goody bag say about you?"" is funny, because nothing screams “future leader” like a branded stress ball, a flimsy pen, and a notebook that quietly whispers, “You will never afford a house.”"
en_2208,"My husband was shocked to see headlines about “walkaway wives” leading the charge in midlife divorce—he said, “Why would you just walk away?” which is ironic, considering he’s been emotionally Ubering away from this marriage for 15 years."
en_2209,"Frank put up a “Don’t Tread on Frank” flag after the HOA tried to ban lawn signs, and now half the neighborhood thinks he’s leading a tiny revolution—when really he’s just defending his right to grow dandelions taller than their political arguments."
en_2210,"Isn’t it weird how The Weeknd’s ‘After Hours ‘Til Dawn’ Tour grosses over $1 billion, and yet I’m still checking my bank account like a surprise opening act is gonna walk onstage and explain where my money went?"
en_2211,"Isn’t it weird that when Zac Efron shows up for his brother's performance during ""DWTS"" Prince Night celebration, every sibling watching at home suddenly thinks, “Wow, my family can’t even be bothered to like my Instagram Reel”?"
en_2212,Isn’t it funny how “How 6 organizers are building effective global health solutions from the bottom up” really just means six very tired people trying to convince the world to wash its hands before they touch the snack table?
en_2213,"Nvidia said there’s no AI bubble, which makes sense—whenever their earnings report drops, it just keeps adding more G’s to “GPUs” and fewer P.E.’s to “P/E ratio.”"
en_2214,"NASA unveils close-up pictures of the comet popping by from another star, and scientists are stunned to discover it’s just a giant interstellar door-to-door salesman asking if anyone needs an extended warranty on their planets."
en_2215,"Yes, technically you burn more fat by working out on an empty stomach—right after your body finishes feasting on your happiness, willpower, and will to live."
en_2216,"They said “How Troy Parrott broke the internet, in 5 easy memes,” but honestly the real miracle isn’t that he broke it—it’s that he managed to explain it to boomers in only five."
en_2217,"You ever notice frost flowers are basically nature’s version of ghosting—look amazing for one brief, magical moment, and the second you reach out, they disappear like, “Oh, you thought this was going to be something?”"
en_2218,"Ireland to face Czech Republic with home final possible — which is great, because nothing says “home advantage” like explaining the offside rule to your nan while she’s asking if the Czech Republic brought enough jackets."
en_2219,"Isn’t it funny that “Inside the Amazon’s sacred food rituals few outsiders see” just sounds like what’s happening in my kitchen every night—except their mysterious chant is probably more organized than me yelling, “What do you guys want now, we JUST ate?”"
en_2220,"Funny how every world summit says, ""The needs of ordinary people must be placed at the centre of the world’s agenda,"" and then the first item is always, ""Let’s agree on a 37-page acronym for this meeting."""
en_2221,"Hurricane Melissa’s record 252 mph winds have officially been declared “shocking,” especially by the same officials who were shocked last year that paving over wetlands might have consequences."
en_2222,"I tried those ""9 one-pot wonders to get you through the cold weather,"" but by the time winter ended, the only real wonder was how I still owned just one pot and nine different ways to burn soup."
en_2223,"Washington’s governor declares emergency so Seattle airport will get fuel despite pipeline leak—finally, a government plan that both fixes a crisis and guarantees your flight will only be delayed by incompetence, not physics."
en_2224,"Isn’t it funny how every Black Friday do’s and don’ts list says “make a budget,” but the only “expert-approved tips we swear by” are things like, “If the TV is 70% off, you can’t afford NOT to buy three”?"
en_2225,"Isn’t it funny how in the NFL, “public punishment” means a press conference and some awkward apologies—meanwhile Giants’ Abdul Carter is rushing to get past it like, “Can I just tackle a 250-pound man instead, that’s less painful?”"
