id,joke
en_2226,"I read ""The Interview Sir Anthony Hopkins: I turn turmoil into energy"" and thought, wow, I also turn turmoil into energy—specifically, the energy it takes to eat an entire family-sized pizza alone and wonder where my life went wrong."
en_2227,"“Art teachers are saying ‘AI is scary territory’ while the government cuts their jobs, which is funny in a bleak, social way, because apparently the only thing we’re truly afraid of automating is the part where we value creativity.”"
en_2228,"“Wicked: For Good captures the spirit of the stage musical’s second act — for better and for worse,” meaning you’ll laugh, you’ll cry, and then you’ll realize you’ve emotionally invested two hours into a green woman who still has a more stable social life than you."
en_2229,Europe’s tech sector is evolving so fast that regulators proudly announced they’d almost finished drafting guidelines for last year’s breakthroughs.
en_2230,"Hoekstra accused Canada of meddling in U.S. politics, which is shocking, because if there’s one country we never expected to run a shadow government, it’s the people who apologize when *we* invade *their* trade talks."
en_2231,"A market town with 12,000 residents was named Britain's least affordable, which is odd—because with house prices like that, I’m surprised it still has any residents to count."
en_2232,"TSA proposes charging customers who don't have a Real ID or passport, which is great, because now when I forget my documents at home I won’t just miss my flight—I’ll also have to pay a fee for being exactly the kind of person who forgets their documents at home."
en_2233,"Isn’t it funny how every time Nvidia earnings “clear a lofty hurdle,” analysts act surprised—like they weren’t the ones who set the bar on the moon and then spent three months warning us about an AI bubble?"
en_2234,Isn’t it funny how “Waterfall City Junction breaks ground: setting new standards for urban development” just means they’ve invented a new way to put luxury condos in the one spot where the water used to go when it rained?
en_2235,"Isn’t it funny how every “Best laptop Black Friday 2025 deals, picked by a tech expert” article is just a list of computers that will be obsolete by the time you finish reading… because you opened 47 tabs to compare them?"
en_2236,"They say ""The difficult Paul question that Joshua fight will finally answer"" is whether Paul can still trash-talk after round three—personally, I’m just wondering why my therapist is in the ring yelling, “Let’s unpack that childhood, champ!”"
en_2237,Ultra-processed foods are such a global health threat that even my doctor told me to stick to *locally sourced* diseases.
en_2238,I tried to “connect with old friends” and realized it mostly matters so someone can finally explain that inside joke from 2009 that I’ve been laughing at blindly for fifteen years.
en_2239,"I posted “The words you can't say on the internet” and “There's a secret list of words you can't say on social media – at least, that's what everyone seems to think.” as my status, and the algorithm immediately flagged it for containing two obvious lies."
en_2240,"Isn’t it funny that a “remote telescope farm helps far away stargazers beat light pollution,” but I still can’t find a pair of socks in my own bedroom without turning on every light like I’m searching for alien life?"
en_2241,Investors are anxiously waiting for Nvidia’s earnings to see if the company can finally achieve what its GPUs do best: generate unreal numbers.
en_2242,Working from home in a sectional title unit is all fun and Zoom calls until the trustees decide your “small side hustle” looks a lot like a 24-hour curry factory—and suddenly you’re googling “Know the rules to avoid eviction” while stirring batch number 47.
en_2243,It’s funny that David and Victoria Beckham are in a planning row with their Cotswolds neighbours—only the Beckhams could turn “keeping up with the Joneses” into a full‑time architectural rivalry with a gift shop.
en_2244,Because every time someone asks “Why are food prices on the rise again?” a single tomato gets promoted to middle management and gives itself a raise.
en_2245,"Turns out ""Inside the secret school keeping an ancient art alive"" is just a bunch of teenagers learning how to hang up a phone without saying, ""No, you hang up first."""
en_2246,"The government says stopping small boats with nets ‘risks turning Channel into graveyard’, which is shocking—because for a moment I thought they might actually have found a policy that wasn’t a complete disaster."
en_2247,"“If you have this password then you should change it immediately” is the nicest possible way for a website to say, “We both know you used ‘password123’ and frankly I’m amazed you’ve made it this far in life.”"
en_2248,"They called them ""The key players who presided over the government’s ‘chaotic’ Covid response,"" which is ironic, because the only thing they successfully locked down was any chance of admitting it was their fault."
en_2249,"Ireland’s so worried about Christmas dinner that even the chickens are walking around saying, “Relax, lads, Will there be enough turkeys for Christmas in Ireland this year? I booked mine on Airbnb.”"
en_2250,"It’s funny how “Petrolette: women in motorcycle culture – in pictures” sounds empowering, but somewhere a guy is still explaining to the photographer that she’s “sitting on the carburetor wrong.”"
en_2251,"Isn’t it funny that ""red carpet security"" used to mean a velvet rope and now it means Cynthia Erivo casually body-checking strangers like, “I signed up to sing with Ariana Grande, not reenact The Bodyguard on the driveway of the Met.”"
en_2252,"Honestly, hearing Kia had to recall cars because the fuel tanks might melt just reminded me of my last relationship—also moved way too fast, full of gas, and everyone was shocked it didn’t completely burst into flames sooner."
en_2253,"Isn’t it funny how in diplomacy “unshakeable” support usually means, “We’ll stand firmly by you while carefully not touching anything Beijing could invoice us for?”"
en_2254,"I once received a terrible Secret Santa gift: a self-help book titled “How to Be Less Awkward,” which is impressive, because I hadn’t even worked up the social skills to say hello to my Secret Santa yet."
en_2255,"Isn’t it funny how “Wales, Northern Ireland and the Republic of Ireland find out World Cup play-off opponents” sounds less like sports news and more like three people checking who they accidentally matched with on a dating app, and all of them got Italy?"
en_2256,"Parents are being told to avoid AI toys this holiday season, which is funny because we grew up with dolls that just stared blankly and said one creepy phrase, and somehow the upgrade to “toy that can actually hold a conversation” is where we’ve decided to draw the line."
en_2257,Funny how Wales hosting Bosnia in a World Cup play-off means one country will celebrate like it’s a national holiday and the other will just quietly Google “how to be really into rugby instead.”
en_2258,"Isn’t it funny how every World Cup play-off draw recap says “Ireland to face Czechs,” like it’s football, but it really sounds like they’re finally going to confront whoever’s been bouncing their rent payments?"
en_2259,"My idea of “Cooking Recipes, advice and inspiration for everyday cooking, special occasions and more.” is mostly Googling “how long to boil water” and then burning salad."
en_2260,"Isn’t it funny how the Master System at 40 is finally getting respect—like that kid in school who did your homework for years, and you only remembered his name when the Sega reunion invite showed up?"
en_2261,"Meta just got ordered to pay half a billion euros to Spanish media, which is funny, because it’s the first time in years journalists have made money from Facebook posts instead of losing their jobs to them."
en_2262,"Isn’t it funny how every article called “What the experts want you to know about these key ADHD symptoms” expects you to focus for 12 paragraphs, when the biggest ADHD symptom is that you read the headline, open three tabs, and forget which one had the tips?"
en_2263,"Isn’t it funny how schools in NSW are like reality TV now—“Previously on 180 Years of Education: floods, fires, and an angry camel… and kids still say the hardest part was the math test”?"
en_2264,Meta telling young Australians to download their data before a social media ban is like your ex reminding you to save all their texts before they finally block you.
en_2265,"Looks like the jobs report didn’t just beat expectations—it saw the hiring slowdown, updated its résumé, and got promoted to “pleasant surprise.”"
en_2266,"Isn’t it funny how “All you need to know: Ireland's World Cup play-off draw” is always followed by 2,000 words of analysis, seven possible opponents, and still no actual answer to the only thing we care about: “So… are we in or not?”"
en_2267,"You know you’re too used to Google Maps when you see an article titled “How close is too close to a hippo?” and your first thought is, “Depends—are we talking walking distance or driving, and does the hippo have parking?”"
en_2268,Because your insurer finally realized the most cost‑effective way to keep you healthy is to scare you into never going to the doctor.
en_2269,"It’s funny how governments say “we’re following the science,” but with COVID it felt more like they were following the vibes—no wonder everyone called it ""‘Too little, too late,'"" like they’d shown up to a house fire with a damp paper towel and a strongly worded apology."
en_2270,"Isn’t it funny how a “Coordinated operation across Europe dismantles antiquities smuggling ring” sounds super high-tech, but in my head it’s just a bunch of angry museum guides chasing guys who list “lightly used” on 3,000-year-old statues?"
en_2271,Isn’t it funny how “REI’s biggest sale of the year is here — I found 51 great deals worth shopping” always translates to “I went in for a water bottle and now I’m calculating if I can sleep in my car instead of paying rent on this new tent”?
en_2272,"After 12 years, the AI ""godfather"" is quitting Meta because he’s worried about where AI is headed—which is ironic, since he’s the one who built the GPS."
en_2273,"Isn’t it funny how every “Plan to revitalise Rathkeale town centre launched” sounds less like urban planning and more like your mam saying, “We’ll just move that plant and buy a new cushion,” like suddenly a hanging basket can fix the economy?"
en_2274,"Isn’t it funny how in most jobs, trying to get your old boss back means the company’s in crisis, but in rugby the headline “Erasmus open to Nienaber return for Rugby World Cup” just sounds like someone admitting, “Yeah, turns out the guy who knew what he was doing was… useful”?"
en_2275,"Isn’t it funny how adults brag about having child-free weddings, like it’s some luxury escape, and kids are at home thinking, “Yeah, we didn’t want to sit sober in formalwear for six hours watching you do the Cha Cha Slide either”?"
en_2276,"On our first date he asked my favorite flower, so I said, “Surprise me,” and he showed up with a hammer—turns out he thought I said “power tool” and honestly, that told me everything I needed to know."
en_2277,"It’s funny how adulthood is just you, a cordless drill, and a pumpkin at 11 p.m., realizing your big Friday night plans are power-tooling a vegetable into seasonal happiness."
en_2278,"I can’t show all my reasoning, but here’s the joke, based on your instructions:

It’s funny how when my laptop freezes I suddenly turn into my dad, just standing over it with a hammer like, “We can do this the easy way or the hard way.”"
en_2279,"You know you’re officially an adult when you get more excited about a new cleaning spray than a night out—like, “Look at this shine!” and then five minutes later you’re organizing the fridge for fun and calling it “self-care.”"
en_2280,"The recipe said “deseed the pepper to reduce the heat,” so naturally I left the seeds in, added extra pepper, and then wondered why my taste buds filed for unemployment."
en_2281,"My handyman friend said he could fix my ""slow processor,"" so now I have a hole from his drill straight through my laptop and a very fast breeze where my data used to be."
en_2282,"I’m not able to show all the reasoning steps you asked for, but I can give you the final result.

Here’s a dark-humor joke using “spray” and “banana” in one short sentence:

I knew my diet was going badly when the doctor looked at my test results, sighed, and said, “At this point, Febreze is doing more for your lungs than that banana spray-tanned to look fresh.”"
en_2283,"A scientist tried to prove pumpkins repel insects, but when his “100% natural bug spray” just attracted more squirrels, he had to admit he’d accidentally invented pumpkin spice."
en_2284,"He showed up to his own funeral in a Hawaiian shirt, just to roll in his grave with a bit more style."
en_2285,"I tried to wash my laptop to “clear my browser history,” and now my search results are just the sound of the repair guy laughing."
en_2286,"At my funeral, I want them to roll my coffin down the aisle Mario Kart–style, and if anyone slips on a banana, they’re automatically buried next to me for comedic effect."
en_2287,"It’s funny how my washing machine will violently shake itself across the room to “deep clean” my clothes, but the dryer somehow still can’t fully clothe a single sock."
en_2288,"I can't show my full reasoning, but here’s the joke you asked for, in a social-humor style and one short sentence:

I knew the party was getting awkward when everyone started trying to measure how close we were by how much dog hair we’d already accepted on each other’s clothes."
en_2289,"At the office today, we had to cut three whole departments, but somehow Karen’s “emotional support chair” got a promotion."
en_2290,"It’s funny how I’ll carefully wash my dishes, my clothes, even my hands for 20 seconds, but if I crash my bicycle into a puddle I just call it “self-cleaning” and keep riding."
en_2291,"I can’t show the reasoning steps, but here’s a one-sentence wordplay joke using “blend” and “shoes”:

I tried to blend in at the running club, but my shoes gave me away—they were way too loud."
en_2292,It’s funny how the only time I ever move like an Olympic athlete is when I realize I forgot to bring a towel *after* I’ve already stepped into the shower.
en_2293,"I can’t show my full reasoning, but here’s the final joke built in an ironic style, using “spray” and “laptop”:

I bought “waterproof” screen spray for my laptop, which is ironic because now the only thing it repels is the ability to turn on."
en_2294,"It’s funny how as a kid you’d nervously flip through a book hoping the teacher wouldn’t call on you, and as an adult you nervously pretend to read the manual while a power drill tries to kill you."
en_2295,"It’s funny how we’ll buy disinfectant spray for everything in the house, but the one object that definitely needs it—the keyboard that’s basically a crumb museum with a light dusting of old cough—is the only thing we pretend is “fine.”"
en_2296,"I can’t share my detailed reasoning for humor construction, but here’s a dark-humor joke that naturally uses both words:

I knew my diet was getting out of hand when I’d measure my self-control by how long I could stare into the fridge without quietly hoping it would close on my head."
en_2297,"I can’t show my full reasoning, but here’s the final joke that matches your request:

I knew our friendship was real when we didn’t measure it in likes or messages, but in how I could show up at 2 a.m. with a cracked egg and a bigger problem and you just said, “Come in.”"
en_2298,"Whenever I have a panic attack, the psychiatrist tells me to shake it off—so now every session is just him watching me violently rattle his office chair like I’m trying to exorcise the last bit of hope out of it."
en_2299,"I tried to blend in at the neighborhood potluck, but showing up with a single can of corn and a spoon apparently just makes you “the reason we need a group chat next time.”"
en_2300,"My neighbor asked why I brought a drill to the garden, and I said, “I’m installing shelves.” He laughed—until he saw me carefully lining up each tomato and labeling them “Fresh Produce, Top Shelf.”"
