id,joke
en_2001,"Panamanian lawmakers’ Taiwan trip sparks diplomatic row with China, which is hilarious because most politicians can’t even manage a layover without causing a scandal, and now their frequent-flyer miles are more stable than their foreign policy."
en_2002,"Isn’t it funny how football clubs are like people at a sale—Carra says “Liverpool must sign in January - even after summer spending spree,” like they’ve just blown thousands on clothes and gone, “Yeah, but I don’t *feel* like a title contender yet.”"
en_2003,"Experts warn of health threat posed by ultra-processed foods, which is shocking, because I always assumed the real danger was my gym membership automatically renewing."
en_2004,"Amazing how at Dick Cheney’s funeral, George W. Bush giving the eulogy still wasn’t the most uncomfortable thing Cheney ever made someone else do."
en_2005,"Isn’t it funny how in sports they say there’s ""No place for Mostert distraction in South Africa team,"" like the real problem is one guy’s focus and not the 60 million armchair coaches yelling at their TVs in perfect tactical hindsight?"
en_2006,"It’s funny how football fame works—“Meet Troy - the parrot named after Ireland’s hat-trick hero,” and now there’s a bird getting more interviews for screaming “OFFSIDE!” than most pundits do for explaining it."
en_2007,"Isn’t it funny that “Instagram to start closing Australian teen accounts ahead of social media ban” sounds less like a news headline and more like every parent’s dream excuse to finally say, “Sorry mate, it’s not me taking your phone—it’s government policy”?"
en_2008,They tried to regulate AI the way they regulate everything in the EU—by writing a 900‑page rulebook that no human can understand and then acting surprised when the only thing that can comply is the AI they were trying to control.
en_2009,You ever notice how “Silent City” sounds peaceful until you stay in one of only two hotels in Malta’s Silent City and realize the silence is just you awkwardly whispering your complaints because everyone can hear everything?
en_2010,"Isn’t it funny how in Ireland, “bringing back Bundee Aki for clash with Springboks in Dublin” sounds less like a rugby decision and more like someone calling their toughest friend to help move a couch… that keeps tackling them?"
en_2011,"Yes, it’s okay if you don’t love your partner all the time—modern relationships are 10% butterflies, 20% shared memes, and 70% politely not committing homicide while they chew loudly next to you."
en_2012,"Isn’t it funny how “Why footballer Troy Parrott is taking the classic Hero's Journey” sounds epic, but in modern football the big dragon he has to slay is just a really passive-aggressive post-match interview?"
en_2013,"Apparently Gen Z are earning six figures as “professional quiet quitters,” which is where companies pay them consulting fees just to explain why no one wants a normal job anymore."
en_2014,"Isn’t it funny how in Hollywood you need “range” to be taken seriously, but when ‘Kim Kardashian had no pretensions that she was a great actress’: Glenn Close hits back at zero-star All’s Fair reviews, suddenly honesty gets worse ratings than the show?"
en_2015,Turns out “fibermaxxing” just means eating enough vegetables that your gut bacteria start writing you thank‑you notes and scheduling reasonable bathroom appointments.
en_2016,"Host Brazil said it’s pushing for progress on big issues at COP30, which is why negotiators were surprised to find the main proposal was just “teach cows to hold their breath.” Still, some see cause for optimism, because honestly, it’s the first climate plan that didn’t immediately get watered down—just slightly moo-ted."
en_2017,"Critic: “Oneohtrix Point Never’s Tranquilizer is uncanny ambient music for an agitated era.”  
Reader: “So it calms you down just enough to clearly understand how doomed everything is?”"
en_2018,"I read “Advice from Whitty and Vallance on delaying lockdown ‘had no grounding in science’” and thought, “Wow, finally some experts operating at my level—I’ve been giving life advice with no grounding in science, finances, or basic common sense for years.”"
en_2019,"Gaelic games reached such peak absurdity at the Asian Youth Championship in Hanoi that the referee had to pause the match to explain to a bewildered hurling stick that, no, it was not in fact a diplomatic envoy from Ireland but a piece of sports equipment participating in Vietnam."
en_2020,"It’s funny how in showbiz they say, “I made mistakes on TV, he made his on a field,” like that’s better—at least when I mess up, nobody has to watch the instant replay in slow motion with a telestrator circling my double chin."
en_2021,"Ottawa’s euthanized feral goldfish are being remembered in a brief ceremony, followed by a much longer moment of silence as officials pretend they didn’t just commit a glittery little genocide."
en_2022,"I told my partner I might not be cut out for non-monogamy, because every time they say they’re seeing other people, I can’t help wondering why I’m never their *type*."
en_2023,"I read ""How Guinness World Records began 7 decades ago,"" and now I’m wondering if the first record was “Most people pretending to care about how Guinness World Records began 7 decades ago.”"
en_2024,"Well, the UK’s Covid inquiry basically concluded the government’s pandemic plan was “too little, too late,” which is impressive, because that’s usually how their support arrives for nurses, renters, and literally anyone under 40."
en_2025,"The Dáil heard that thousands of people are “trapped” on the M7 every day, which is shocking—because with Irish public transport, most of us assumed being stuck in traffic was still the *fast* option."
en_2026,Prada heir Lorenzo Bertelli becoming executive chairman at Versace is like your strict Italian dad running your cool cousin’s party—suddenly the glitter has a five-year strategic plan and even the sequins have performance reviews.
en_2027,"Miriam Toews: A loud voice in a town once ruled by silence—finally, a place where the librarian can shush someone and be accused of government overreach."
en_2028,"He collects pictures of old men’s faces for her, which is sweet until you realize he’s just prepping her for what he’ll look like after another season watching West Ham’s midfield die on the pitch."
en_2029,"Ninja just announced their dual zone air fryer hit its lowest price for Black Friday 2025, which is great news for everyone who’s been thinking, “I wish my kitchen appliance could sneak up on my frozen fries from two directions at once.”"
en_2030,"After the ""You're a disgrace': Dramatic scene as House avoids Rep. Cory Mills censure vote"" headline, Congress clarified that they didn’t actually clear him—they just tabled the censure until they can invent a new punishment called “being forced to read your own quotes on C-SPAN for 12 hours straight.”"
en_2031,"When picking a health care plan, the most important questions to ask are “What’s my deductible?” and “Does this cover the injuries I’ll get from stressing over what my deductible is?”"
en_2032,"Nonalcoholic spirits go from strength to strength because after enough office parties, people realized they wanted to remember their bad decisions in HD instead of reconstructing them from blurry CCTV."
en_2033,"I took “Don’t trade where you tweet” as solid financial advice—so now I just lose money in complete silence, which feels much more professional."
en_2034,"Isn’t it funny that “Three-quarters of parents let children miss school for ‘duvet day’” but still call it “playing hooky,” when the kids are clearly majoring in Advanced Horizontal Studies?"
en_2035,"Nasa releases new images of interstellar comet 3I/ATLAS, and astronomers say it’s truly groundbreaking—mainly because if it actually grounds, we’re all getting a surprise visit from space."
en_2036,"It’s funny how every “well-intentioned” stage adaptation of a grief novella just means you’ll spend two hours watching people cry under a bird-shaped light fixture while a director insists, “The feathers are a metaphor.”"
en_2037,"“Polar vortex could bring wild weather pattern” — scientists say this week we should dress in layers, which is helpful, because I’ve always wondered how many coats it takes to admit you’ve lost the thermostat battle with your own house."
en_2038,"It’s funny how companies say AI is just a “helpful assistant,” but somehow the only thing it’s assisting with is making sure you’re doing three people’s jobs while politely asking it how to fight back."
en_2039,"I tried Alice Zaslavsky’s garlic red peppers with a creamy white bean dip, AKA papula, and now my friends think I’m sophisticated—joke’s on them, I only made it because it uses fewer dishes than ordering takeout."
en_2040,"In California, I’ve been writing about housing for more than a decade, which is ironic, because that’s also how long it takes here to realize your “starter home” is actually just your car with really strong manifesting skills."
en_2041,"Funny how David Muir reports on students learning sign language for a deaf therapy dog’s birthday, and suddenly every human relationship I’ve ever had looks under-celebrated."
en_2042,"Isn’t it weird how the SA Reserve Bank cuts the repo rate to 6.75 percent and every headline screams “what this means for your bond,” like my bank is suddenly going to say, “Surprise, we’ve decided you can keep your kidneys *and* your house this month”?"
en_2043,"It’s funny that SpaceX launches second satellite to monitor sea level changes, as if the ocean were a teenager—“We checked once, but let’s send another satellite to make sure it’s not rolling its eyes and rising anyway.”"
en_2044,"UK schools are closing for ‘Thundersnow’ and a cold snap, proving the weather now cancels plans faster than a group chat when someone suggests meeting before 9 a.m."
en_2045,Border officials say the giant spider web found in the Greek-Albanian cave is the first truly effective immigration policy both countries have ever jointly enforced.
en_2046,"I wondered, ""What is life like living permanently on board a cruise ship?""—turns out it’s just like my regular life, except now when I disappoint people, there’s a mandatory safety drill first."
en_2047,"“Black Friday deals for him that will make the perfect present” is funny, because nothing says “I love you” like a 70%‑off gadget he’ll use once while you quietly enjoy the fact that you saved more money than he thinks the gift cost."
en_2048,"You ever notice how when teachers say, “Group words that share a common thread,” it just turns into nouns forming little cliques while the verbs run around doing all the work?"
en_2049,Isn’t it funny how the Klamath becomes “America's largest river restoration project” only after humans mess it up first—like bragging about being the world champion at cleaning a kitchen you personally destroyed?
en_2050,"Isn’t it funny that the House passes bill to strip Senate phone investigations language from funding bill, when the only phone records Congress should really be worried about are the 47 missed calls from their constituents?"
en_2051,"It’s funny how every country says “We did it!” when they qualify for the World Cup, as if the fans in their living rooms eating chips were out there running sprints instead of just yelling “SHOOT!” at the TV."
en_2052,"Isn’t it funny that the Princess of Wales says her children were “very sad” to miss Paddington at the Royal Variety show, when every other kid’s big disappointment is finding out the guy in the costume is just their sweaty PE teacher?"
en_2053,"NASA unveils close-up pictures of interstellar comet 3I/Atlas, and scientists are stunned to discover it’s just a rock with “BRB, SWITCHING GALAXIES” carved into it in perfect English."
en_2054,"Every time I hear “This painting is the most expensive work of modern art ever sold at auction,” I wonder if the real masterpiece is the canvas—or the straight face of the person explaining why a blue square is “in dialogue with the human condition.”"
en_2055,"Doing these fall garden chores will make your spring easier—because by then, the weeds will be so surprised you were responsible on time that they’ll be too intimidated to come back."
en_2056,"I just read “Owl rescued from concrete mixer now recovering in Utah” and thought, wow, that bird hit rock bottom and is already doing better than me—I willingly mix myself with bad decisions and still don’t have professionals rushing in to save me."
en_2057,"NYC foodies say, “What Mamdani's win means for NYC's food scene” is more vegan options and worker protections, but I’m just wondering when my $19 oat-milk latte will start campaigning for rent control."
en_2058,"Every Black Friday the best VPNs get reduced, which is fitting, because nothing says “online privacy” like proudly announcing to the world that you bought it on sale."
en_2059,"My therapist said, “You should be having more slumber parties with your friends,” which sounds fun until you realize it’s just a polite way of saying, “Your emotional issues now require a group project and matching pajamas.”"
en_2060,"Helmsman, arrested for being on his phone when the ferry ran aground, insisted it wasn’t negligence because he was clearly on a call with “Customer Support for Reality” trying to download the latest map patch where the ocean has an undo button."
en_2061,"Despite record expansion and growing ambition in the continent, the US is surging ahead again—apparently the secret to staying number one is constantly warning everyone else about the dangers of ambition and expansion."
en_2062,"Isn’t it funny how Lily Allen can disappear for seven years, come back with ""West End Girl"" about heartbreak and healing, and we all call it “a brave artistic journey,” but if I vanish that long after a breakup it’s just my friends saying, “So… you gonna return my Tupperware or what?”"
en_2063,"I read “Gambling probes halt lower leagues and suspend hundreds of players, but many say they are scapegoats,” and thought, “Wow, that’s exactly like my dating life—everyone claims they’re innocent, everything gets suspended, and somehow I’m still the only one who actually gets played.”"
en_2064,"Sure—here’s the joke, in one short sentence:

“7 tips for getting to sleep during cold weather living: step one, stop checking the thermostat you can’t afford to turn up.”"
en_2065,"Scientists calling kissing an “evolutionary conundrum” is hilarious—humans spent millennia perfecting the art of smooching, and only now do we have a map, as if some caveman once said, “I’m not kissing you unless there’s peer‑reviewed data.”"
en_2066,"It’s funny that Anna Ansari’s cookbook is called *Silk Roads*, because whenever I try to recreate food from my travels, the only thing that actually transports me back is the food poisoning."
en_2067,"In times of sweeping change, clarity matters most—said every company right before sending a 47-page PDF explaining nothing."
en_2068,"I subscribed to ""The World in Pictures Get The AP’s most compelling photographs sent directly to your inbox,"" but all I get is a daily close-up of my shocked face when I realize I’ve been staring at my email for four hours instead of living in the actual world."
en_2069,"It’s funny how Nvidia’s blowout earnings can launch a massive morning rally, and by the afternoon your portfolio looks like it bought tickets to the excitement and then left early to beat the traffic."
en_2070,"I just saw the ""Moment a Gustav Klimt painting sells for record amount"" and thought, “Wow, somebody just paid $100 million for something confusing and unfinished,” which is weird, because my ex got that from me for free."
en_2071,"Millennials are set to inherit tons of their parents' stuff — which is perfect, because nothing says “financial independence” like owning six china sets, three broken rocking chairs, and zero housing."
en_2072,"Apparently “World Cup 2026 playoffs draw: reaction and updates” is just football’s polite way of saying, “Here’s the exact moment half these countries start Googling what ‘mathematically still possible’ means.”"
en_2073,"Inside the courtroom for Australia's biggest trials, the most shocking revelation was that everyone had already judged the case—except the jury."
en_2074,"Isn’t it funny how “US tech group’s quarterly sales outstrip expectations, reassuring investors and boosting shares worldwide” really just means some app convinced us to pay $14.99 a month to keep doing what we were already doing for free?"
en_2075,"It’s funny that boomers think Gen Z and millennials are lazy for avoiding management, when “conscious unbossing” just means we finally realized every promotion is basically, “Congrats, here’s more emails and fewer boundaries—also, you’re responsible for Brad now.”"
en_2076,"It’s funny that Abbott just paid $23 billion for the company that makes Cologuard, because only in American healthcare can a poop-in-a-box test be worth more than most entire hospitals."
en_2077,"At the funeral, George W. Bush said Dick Cheney always had his back—mostly because he was standing in front of him, taking all the shots."
en_2078,"Isn’t it funny that a Paris court blocks auction of earliest-known calculator, like even in 2026 we’re still trying to stop machines from doing the math on how much we’re worth?"
en_2079,"I tried limiting my time online, but now I just spend twice as long googling “how to limit time online” and counting that as progress."
en_2080,"Isn’t it odd that “The AI Shift: Do we prefer talking to machines rather than each other?” sounds less like a tech headline and more like the moment you realize the chatbot actually listens, remembers your birthday, and doesn’t interrupt to tell you about its fantasy football league?"
en_2081,"In Kentucky, ""eating like a pro"" just means realizing the bourbon on your ribs has a higher proof than anything you’ve ever made for dinner."
en_2082,"Therapists now recommend holding an ice cube and shaking like a dog to reduce stress, which is impressive progress when you realize the previous medical advice was just “be the reason other people need therapy.”"
en_2083,"The Thanksgiving travel tips article said the worst day to fly is Wednesday and the worst day to drive is Sunday, which is helpful, because now I know the best day to travel is never."
en_2084,"“Students are protesting a course taught by AI, which is hilarious, because for the last five years every professor’s been reading PowerPoint slides from 2009 and we all just pretended it wasn’t already automated.”"
en_2085,"It’s funny how cruise ads say “From cuisine and culture to history and nature, find the ideal cruise,” as if my ideal cruise isn’t just finding the one where I can eat unlimited shrimp without accidentally learning anything."
en_2086,"Isn’t it funny that a Frida Kahlo self-portrait is about to shatter auction records, while the best I can manage in the mirror is, “Wow, that’s a brave angle for my chin to choose today”?"
en_2087,"LeBron James just started his 23rd NBA season playing against guys born after he debuted, which is inspiring—because apparently if you stick around long enough, “veteran leadership” is just code for “babysitting with a max contract.”"
en_2088,"So the new wipes are fully flushable, biodegradable, and eco-certified—meaning the only thing we’re really testing is how long human plumbing can keep pretending it’s a marine ecosystem."
en_2089,"Everyone’s asking, “Ní thuigim: does AI even understand Gaeilge?” and I’m like, if it did, it would’ve run away already after being told “craic” is fun, “mad” is good, and “deadly” is a compliment."
en_2090,"Scientists are worried sea level rise will flood toxic sites, which is ironic, because apparently the ocean finally found a way to do an environmental impact statement on us."
en_2091,"They say history's ""most controversial"" queen was so hated because of her ruthless politics, but actually it started when she replaced the royal decree with a group chat and kept reacting “LOL” every time a neighboring kingdom declared war."
en_2092,What you can do in your 30s to stay healthy at 70: start saving now so you can afford all the wellness gadgets that promise to fix the damage you’re doing in your 30s.
en_2093,"Thousands of US hazardous sites are at risk of flooding from sea level rise, which is exciting because for the first time in history the ocean is coming to us for our chemicals instead of us dumping them in."
en_2094,"When I saw the headline “The Nazis on trial: The enduring lessons of Nuremberg, 80 years on,” I thought, “Wow, history really teaches accountability”… then remembered I still blame my group projects on ‘circumstances beyond my control.’"
en_2095,"Isn’t it funny how every article asks, “Is modular construction the answer to the housing crisis,” like the real problem isn’t zoning or prices, it’s that we forgot to click “add extra bedroom” at checkout?"
en_2096,"Las Vegas police are asking for the public’s help finding a casino armed robbery suspect, which is weird, because I thought the house always wins—except, apparently, at background checks."
en_2097,"They saw Claire Danes grieving in *The Beast in Me* and thought, “Sure, my therapist charges $200 an hour to emotionally wreck me, but at least HBO throws in a free trauma subplot and better lighting.”"
en_2098,"Liverpool chairman opens up on contract talks with Salah and Van Dijk: “We’ve agreed Salah gets more goals, Van Dijk gets more clean sheets, and I get more anxiety every time their agents call.”"
en_2099,"Lending experts predict that mortgage rates might finally drop this December—right after you’ve locked in at 30 years, bought holiday gifts on credit, and decided 2024 is the year you “get your finances together.”"
en_2100,"Isn’t it funny how provinces will drop trade barriers on everything except food and alcohol—like, “Yes, you may freely ship your industrial ball bearings, but that cheddar and chardonnay are clearly a national security threat.”"
en_2101,"Major League Baseball signs deals with Netflix, ESPN and NBCUniversal—perfect, now fans can stream eight hours of negotiations, lockouts, and replay reviews without being interrupted by the occasional baseball game."
en_2102,"In Catstanbul, the mayor passed a new law requiring all cars to use turn signals, not for safety, but so the street cats can rate their performance and hiss at anything under four stars."
en_2103,"Developers in Berkeley say they “respect labor standards,” which is why they very carefully went around them."
en_2104,"The mystery of the abandoned Achill Island village of Slievemore was finally solved when historians realized everyone left right after the first influencer posted, “Omg, no Wi‑Fi?” on Social media."
en_2105,"Isn’t it funny how an Olympic gold medallist gives 5 key tips for older swimmers returning to the pool, but the only one we actually follow is “remember where you left your glasses before you dive in”?"
en_2106,"Scientists say the first kiss dates back 21 million years, which is impressive, because modern humans have had that long to practice and still open with “So… uh… do you like podcasts?”"
en_2107,"The Manchester derby live on Sky in January is perfect timing — just when everyone’s New Year’s resolution is to be less stressed, they schedule 90 minutes of shouting at the TV."
en_2108,"Interesting Times with Ross Douthat is all about mapping the new world order, which is perfect, because I still get lost in my own apartment if someone moves a chair."
en_2109,"“‘A different vibe’: New York welcomes the luxury private cinema experience”—finally, a place where you can pay $500 to watch a movie alone and still feel the crushing loneliness of your studio apartment, just with better surround sound."
en_2110,"Because Josie had “known” all week that her grandson Troy Parrott would score against Hungary, the only real surprise was that the TV commentary didn’t just say, “As predicted by Nan, Ireland takes the lead.”"
en_2111,"Isn’t it funny how every few months there’s a headline like “New study finds that fluoride in drinking water may not affect cognitive ability,” and my brain’s like, “Cool, so what’s my excuse for trying to microwave my coffee in the fridge?”"
en_2112,"Headline: ""When racing thoughts are interrupting your sleep, here’s what to do"" — funny, the article suggests deep breathing, but my racing thoughts are already training for a marathon while I’m just trying to qualify for a nap."
en_2113,"The Air Quality Index is basically society’s way of saying, “Remember when we used to check the weather to decide what to wear, not whether it was safe to have lungs?”"
en_2114,"Isn’t it funny how all these articles ask, “Will life insurance be worth it for seniors in 2026?” like seniors are planning to cash it in themselves—“Don’t worry, by the time the check shows up, I’ll be the only one not complaining about the paperwork.”"
